{
  "$schema": "https://json-schema.org/draft/2020-12/schema",
  "$id": "https://liesdonk.nl/questfoundry/v1.0.0/schemas/session_ledger.schema.json",
  "title": "Session Ledger",
  "type": "object",
  "required": ["version","session_id", "entries"],
  "properties": {
    "version": {"type": "string", "const": "1.0.0"},
    "session_id": {"type": "string"},
    "entries": {
      "type": "array",
      "items": {
        "type": "object",
        "required": ["timestamp", "actor", "action"],
        "properties": {
          "timestamp": {"type": "string", "format": "date-time"},
          "actor": {"type": "string"},
          "action": {"type": "string"},
          "data": {}
        }
      }
    },
    "stable": {"type": "boolean"},
    "cycle": {"type": "integer", "minimum": 0},
    "state": {"type": "string", "enum": ["drafting", "revision", "stabilizing", "stable"]}
  },
  "additionalProperties": false
}
